{
  "schema_version": "ordo.editor.verification_check.v1",
  "id": "repo_check",
  "title": "Repository/package references",
  "group": "package",
  "description": "Validate repository-level references and generated metadata for the extracted candidate",
  "order": 200,
  "enabled": true,
  "requires": [],
  "timeout_seconds": 180,
  "runner": {
    "type": "command",
    "command": [
      "python",
      "-m",
      "ordo.cli",
      "repo-check",
      "{package_root}"
    ]
  }
}
